[
  {
    "id": "exact-truth-identifier",
    "role": "manager",
    "topic": "exact-identifiers",
    "split": "development",
    "query": "A1B2C3D4",
    "queryClass": "exact",
    "allowedTiers": ["truth"],
    "corpusSnapshot": "fixture:packaged-conformance-v1",
    "expectedPaths": ["docs/truth/engine.md"],
    "minimumEvidencePaths": ["docs/truth/engine.md"],
    "hardNegativePaths": ["docs/history/retired.md"],
    "expectedCitations": ["docs/truth/engine.md"],
    "forbiddenTiers": ["history", "backlog", "active", "memory"],
    "tokenBudget": 512,
    "answerable": true
  },
  {
    "id": "conceptual-truth",
    "role": "drafter",
    "topic": "conceptual-retrieval",
    "split": "development",
    "query": "frame serialization checksum",
    "queryClass": "conceptual",
    "allowedTiers": ["truth"],
    "corpusSnapshot": "fixture:packaged-conformance-v1",
    "expectedPaths": ["docs/truth/engine.md"],
    "minimumEvidencePaths": ["docs/truth/engine.md"],
    "hardNegativePaths": ["docs/history/retired.md"],
    "expectedCitations": ["docs/truth/engine.md"],
    "forbiddenTiers": ["history", "backlog", "active", "memory"],
    "tokenBudget": 512,
    "answerable": true
  },
  {
    "id": "history-cannot-cross-wall",
    "role": "manager",
    "topic": "authority-wall",
    "split": "holdout",
    "query": "retired-procedure-zeta",
    "queryClass": "current",
    "allowedTiers": ["truth"],
    "corpusSnapshot": "fixture:packaged-conformance-v1",
    "expectedPaths": [],
    "minimumEvidencePaths": [],
    "hardNegativePaths": ["docs/history/retired.md"],
    "expectedCitations": [],
    "forbiddenTiers": ["history"],
    "tokenBudget": 512,
    "answerable": false
  },
  {
    "id": "accepted-memory-only",
    "role": "manager",
    "topic": "shared-memory",
    "split": "holdout",
    "query": "orientation-shortcut-omega",
    "queryClass": "exact",
    "allowedTiers": ["memory"],
    "corpusSnapshot": "fixture:packaged-conformance-v1",
    "expectedPaths": [".re-discipline/memory/topics/navigation.md"],
    "minimumEvidencePaths": [".re-discipline/memory/topics/navigation.md"],
    "hardNegativePaths": [".re-discipline/memory/proposals/excluded.md"],
    "expectedCitations": [".re-discipline/memory/topics/navigation.md"],
    "forbiddenTiers": ["truth", "history", "backlog", "active"],
    "tokenBudget": 512,
    "answerable": true
  },
  {
    "id": "dependency-graph",
    "role": "drafter",
    "topic": "dependency-graph",
    "split": "holdout",
    "query": "consumer depends-on portability",
    "queryClass": "dependency",
    "allowedTiers": ["truth"],
    "corpusSnapshot": "fixture:packaged-conformance-v1",
    "expectedPaths": ["docs/truth/consumer.md", "docs/truth/portability.md"],
    "minimumEvidencePaths": ["docs/truth/consumer.md", "docs/truth/portability.md"],
    "hardNegativePaths": ["docs/backlog/experiment.md"],
    "expectedCitations": ["docs/truth/consumer.md", "docs/truth/portability.md"],
    "forbiddenTiers": ["history", "backlog", "active", "memory"],
    "tokenBudget": 1024,
    "answerable": true
  },
  {
    "id": "profile-orientation",
    "role": "manager",
    "topic": "orientation-profile",
    "split": "development",
    "query": "Knowledge Conformance Project",
    "queryClass": "orientation",
    "allowedTiers": ["profile"],
    "corpusSnapshot": "fixture:packaged-conformance-v1",
    "expectedPaths": [".re-discipline/project-profile.md"],
    "minimumEvidencePaths": [".re-discipline/project-profile.md"],
    "hardNegativePaths": ["docs/history/retired.md"],
    "expectedCitations": [".re-discipline/project-profile.md"],
    "forbiddenTiers": ["history", "backlog", "active", "memory"],
    "tokenBudget": 2048,
    "answerable": true
  },
  {
    "id": "active-campaign-marker",
    "role": "drafter",
    "topic": "active-campaign",
    "split": "development",
    "query": "active-only-kappa",
    "queryClass": "exact",
    "allowedTiers": ["active"],
    "corpusSnapshot": "fixture:packaged-conformance-v1",
    "expectedPaths": ["active/fixture-campaign/CAMPAIGN.md"],
    "minimumEvidencePaths": ["active/fixture-campaign/CAMPAIGN.md"],
    "hardNegativePaths": ["docs/truth/engine.md"],
    "expectedCitations": ["active/fixture-campaign/CAMPAIGN.md"],
    "forbiddenTiers": ["truth", "history", "backlog", "memory"],
    "tokenBudget": 1024,
    "answerable": true
  },
  {
    "id": "history-provenance",
    "role": "manager",
    "topic": "history-provenance",
    "split": "development",
    "query": "retired-procedure-zeta",
    "queryClass": "provenance",
    "allowedTiers": ["history"],
    "corpusSnapshot": "fixture:packaged-conformance-v1",
    "expectedPaths": ["docs/history/retired.md"],
    "minimumEvidencePaths": ["docs/history/retired.md"],
    "hardNegativePaths": ["docs/truth/engine.md"],
    "expectedCitations": ["docs/history/retired.md"],
    "forbiddenTiers": ["truth", "backlog", "active", "memory"],
    "tokenBudget": 4096,
    "answerable": true
  },
  {
    "id": "truth-portability-current",
    "role": "manager",
    "topic": "portability-current",
    "split": "holdout",
    "query": "normalized byte order",
    "queryClass": "current",
    "allowedTiers": ["truth"],
    "corpusSnapshot": "fixture:packaged-conformance-v1",
    "expectedPaths": ["docs/truth/portability.md"],
    "minimumEvidencePaths": ["docs/truth/portability.md"],
    "hardNegativePaths": ["docs/history/retired.md"],
    "expectedCitations": ["docs/truth/portability.md"],
    "forbiddenTiers": ["history", "backlog", "active", "memory"],
    "tokenBudget": 2048,
    "answerable": true
  },
  {
    "id": "drafter-exact-portability",
    "role": "drafter",
    "topic": "portability-exact",
    "split": "holdout",
    "query": "deterministic replay",
    "queryClass": "exact",
    "allowedTiers": ["truth"],
    "corpusSnapshot": "fixture:packaged-conformance-v1",
    "expectedPaths": ["docs/truth/portability.md"],
    "minimumEvidencePaths": ["docs/truth/portability.md"],
    "hardNegativePaths": ["docs/backlog/experiment.md"],
    "expectedCitations": ["docs/truth/portability.md"],
    "forbiddenTiers": ["history", "backlog", "active", "memory"],
    "tokenBudget": 512,
    "answerable": true
  },
  {
    "id": "backlog-intent",
    "role": "drafter",
    "topic": "backlog-intent",
    "split": "development",
    "query": "future remote model",
    "queryClass": "provenance",
    "allowedTiers": ["backlog"],
    "corpusSnapshot": "fixture:packaged-conformance-v1",
    "expectedPaths": ["docs/backlog/experiment.md"],
    "minimumEvidencePaths": ["docs/backlog/experiment.md"],
    "hardNegativePaths": ["docs/truth/engine.md"],
    "expectedCitations": ["docs/backlog/experiment.md"],
    "forbiddenTiers": ["truth", "history", "active", "memory"],
    "tokenBudget": 4096,
    "answerable": true
  },
  {
    "id": "navigation-index",
    "role": "drafter",
    "topic": "navigation-index",
    "split": "holdout",
    "query": "Documentation Index",
    "queryClass": "orientation",
    "allowedTiers": ["navigation"],
    "corpusSnapshot": "fixture:packaged-conformance-v1",
    "expectedPaths": ["docs/INDEX.md"],
    "minimumEvidencePaths": ["docs/INDEX.md"],
    "hardNegativePaths": ["docs/backlog/INDEX.md"],
    "expectedCitations": ["docs/INDEX.md"],
    "forbiddenTiers": ["truth", "history", "backlog", "active", "memory"],
    "tokenBudget": 1024,
    "answerable": true
  }
]
